{
  "schema_version": "2.0",
  "action_proposal_id": "action-proposal-SYNTH-001",
  "site_id": "gbos.localhost",
  "processing_purpose": "sales_follow_up",
  "action_type": "internal.work_item.transition",
  "status": "awaiting_approval",
  "decision_ref": "decision-SYNTH-001",
  "evidence_refs": [
    "evidence-SYNTH-001"
  ],
  "requested_by": "agent:sales-SYNTH-001",
  "payload_digest": "cccccccccccccccccccccccccccccccccccccccccccccccccccccccccccccccc",
  "policy_version": "action-guard-v1",
  "created_at": "2026-08-06T01:30:00Z",
  "correlation_id": "corr-SYNTH-001"
}
